编号,状态,问政问题,响应时间,问政时间,链接308230,已受理,东城科技园社区卫生中心何时恢复启用,等待回复：23天23小时46分,2021-10-30 09:22:39,https://wz.sun0769.com/political/politics/index?id=529211
308228,已受理,企业克扣年假问题咨询,等待回复：23天23小时52分,2021-10-30 09:03:42,https://wz.sun0769.com/political/politics/index?id=529209
308274,已受理,分配学校,等待回复：26天0小时58分,2021-10-30 15:35:56,https://wz.sun0769.com/political/politics/index?id=529263
308275,已受理,地铁项目,等待回复：23天22小时27分,2021-10-30 15:27:23,https://wz.sun0769.com/political/politics/index?id=529261
308278,已受理,出指导价之前签合同给定金的房子，是否可以按照合同价批贷？,等待回复：24天21小时58分,2021-10-30 15:16:44,https://wz.sun0769.com/political/politics/index?id=529259
308254,已受理,关于东莞市沙田镇活力粤港小区违法违规行为举报信,等待回复：23天19小时24分,2021-10-30 12:23:04,https://wz.sun0769.com/political/politics/index?id=529234
308231,已受理,拯救生命，刻不容缓,等待回复：23天23小时46分,2021-10-30 09:00:33,https://wz.sun0769.com/political/politics/index?id=529208
308239,待处理,茶山中学放学时间,等待处理：22天7小时46分,2021-10-30 08:37:34,https://wz.sun0769.com/political/politics/index?id=529207
308282,已受理,古梅一中设置重点班,等待回复：23天16小时31分,2021-10-30 15:05:48,https://wz.sun0769.com/political/politics/index?id=529258
